<?xml version="1.0" encoding="UTF-8"?>
<project name="Lore and Mythology" xmlns:xsi="http://www.w3.org/2001/XMLSchema-instance" xsi:noNamespaceSchemaLocation="../schemas/image-caption-array.xsd">

    <stage path="stage-0/">
        <slide>
            <image>opening.png</image>
            <caption>The experience begins in the 1852 Naples Observatory, inviting users to discover the Psyche asteroid through an interactive, period-accurate telescope.</caption>
        </slide>
        <slide>
            <image>past_metaphor.png</image>
            <caption>The Chrysalis: Exploring the mythological parallels between the asteroid's dormant state as a planetesimal core and the chrysalis from Greek lore.</caption>
        </slide>
        <slide>
            <image>transitional_phase.png</image>
            <caption>Bridging eras by transitioning from historical astronomical observation to the modern-day launch of the 2023 Psyche spacecraft.</caption>
        </slide>
        <slide>
            <image>present_metaphor.png</image>
            <caption>The Butterfly: Highlighting the spacecraft's design, where its expansive solar panels symbolize butterfly wings representing the Psyche, "breath of life."</caption>
        </slide>
        <slide>
            <image>future_metaphore.png</image>
            <caption>The Mythos: Uniting the scientific mission with the narrative of the Goddess Psyche, framing the exploration of the asteroid as the realization of her immortality.</caption>
        </slide>
    </stage>

    <stage skip="true"> </stage>

    <stage path="stage-2/">
        <slide>
            <image>launch_page_mockup.jpeg</image>
            <caption>Proposed UI design for the initial launch page, establishing the thematic tone and narrative context of the experience.</caption>
        </slide>
        <slide>
            <image>telescope_experience.png</image>
            <caption>UI mockup of the Asteroid Mythos Phase, showcasing the gamified AR telescope interactions designed for discovering Psyche-16.</caption>
        </slide>
        <slide>
            <image>transitional_mockup.png</image>
            <caption>UI mockup of the transitional phase, bridging the historical discovery phase and the modern spacecraft mission.</caption>
        </slide>
        <slide>
            <image>settings_mockups.png</image>
            <caption>Settings menu mockup highlighting customizable accessibility controls to ensure inclusive engagement for all users.</caption>
        </slide>
        <slide>
            <image>dialog_box_mockup.png</image>
            <caption>UI design mockup of the interactive dialog components used to seamlessly deliver mythological lore and scientific data.</caption>
        </slide>

    </stage>

    <stage path="stage-3/">
        <slide>
            <image>asset-creation.png</image>
            <caption>Asset creation process for the Psyche and Persephone narrative sequence.</caption>
        </slide>
        <slide>
            <image>implementing-3d-elements.png</image>
            <caption>Integration of the early Psyche 3D model prototype into the Skybox environment.</caption>
        </slide>
        <slide>
            <image>initial-help-screen.png</image>
            <caption>Initial user interface prototype for the help and onboarding screen.</caption>
        </slide>
        <slide>
            <image>lore-context-pop-ups.png</image>
            <caption>Contextual UI pop-ups designed to enhance in-world lore and narrative delivery.</caption>
        </slide>
        <slide>
            <image>lore-design.png</image>
            <caption>Early prototyping and layout design for the AMP lore system.</caption>
        </slide>
    </stage>

    <stage path="stage-4/">
        <slide>
            <image>amp-lore.png</image>
            <caption>Implementation of the opening scene, establishing the narrative context for the discovery of Psyche.</caption>
        </slide>
        <slide>
            <image>asteroid modification.png</image>
            <caption>Full integration of high fidelity 3D Psyche asteroid model into the core experience.</caption>
        </slide>
        <slide>
            <image>skybox_search.png</image>
            <caption>Refined Skybox exploration sequence, featuring upgraded visuals and a dynamic blur mechanic to obscure undiscovered elements.</caption>
        </slide>
        <slide>
            <image>smp-prototyping.png</image>
            <caption>Implementation of the UI text system prototype for the satellite mission phase.</caption>
        </slide>
    </stage>

    <stage path="stage-5/">
        <slide>
            <image>reworked-launchpage.png</image>
            <caption>Redesigned launch page UI incorporating the Psyche brand color palette and an optimized layout to reduce text density.</caption>
        </slide>
        <slide>
            <image>telescope-tracking.png</image>
            <caption>Prototype of positional scope tracking mechanics utilizing a placeholder telescope asset.</caption>
        </slide>
        <slide>
            <image>historically-acurate-modeling.png</image>
            <caption>Integration of a historically accurate 3D reflection telescope model featuring fully functional scope tracking.</caption>
        </slide>
        <slide>
            <image>low-res-before.png</image>
            <caption>Decreased poly count on Psyche model, significantly improving performance</caption>
        </slide>
        <slide>
            <image>arrival-countdown.png</image>
            <caption>Implementation of a dynamic countdown system tracking the Psyche spacecraft's arrival at the asteroid's orbit.</caption>
        </slide>
        <slide>
            <image>overlay-corrections.png</image>
            <caption>Resolved layout positioning issues to ensure precise alignment of constellation overlays with the underlying background imagery.</caption>
        </slide>
    </stage>

    <stage path="stage-6/">
        <slide>
            <image>auto-find.png</image>
            <caption>Implementation of an auto-find mechanic to assist and guide users during the discovery phase.</caption>
        </slide>
        <slide>
            <image>continue-track.png</image>
            <caption>Integration of a progress tracking system and streamlined navigation to enhance overall user experience.</caption>
        </slide>
        <slide>
            <image>fonts.png</image>
            <caption>Configured local font hosting to ensure typography consistency and align with brand guidelines.</caption>
        </slide>
        <slide>
            <image>transition.png</image>
            <caption>Refined UI animations during transition phase to create a more seamless and intuitive flow between sequence phases.</caption>
        </slide>
        <slide>
            <image>project-end.png</image>
            <caption>Implementation of a dedicated end screen to provide a cohesive conclusion to the narrative journey.</caption>
        </slide>
    </stage>

    <stage path="stage-7/">
        <slide>
            <image>titles.png</image>
            <caption>Implementation of an integrated caption system to provide clear contextual alignment between visual assets and descriptive text.</caption>
        </slide>
        <slide>
            <image>help.png</image>
            <caption>Redesigned the help interface with a vertical layout and consistent typography to align with global UI patterns across the experience.</caption>
        </slide>
        <slide>
            <image>font.png</image>
            <caption>Standardized global typography across the application to ensure visual consistency and brand alignment.</caption>
        </slide>
        <slide>
            <image>high-res-psyche.png</image>
            <caption>Upgraded the 3D Psyche model with a higher polygon count, optimizing the balance between visual fidelity and rendering performance.</caption>
        </slide>
        <slide>
            <image>layout.png</image>
            <caption>Restructured the arrival countdown UI to ensure fully responsive containment within its primary layout container.</caption>
        </slide>
    </stage>

    <stage path="stage-8/">
        <slide>
            <image>about.png</image>
            <caption>Meet the Mission to Psyche - Iridium team</caption>
        </slide>
    </stage>
    
</project>